{
  "schema_version": "schema_v1",
  "instance_id": "dp_knapsack_01_003",
  "benchmark_version": "v0.3",
  "units": [
    {
      "id": "SU1",
      "description": "Alignment precondition: weights and values have the same length. (0/1 knapsack optimum (variant 3): emphasize each item used at most once across the witness subset.)",
      "criticality": "critical",
      "common_failure_modes": [
        "omitting the length alignment",
        "allowing trailing values to be ignored"
      ]
    },
    {
      "id": "SU2",
      "description": "Capacity feasibility: the witness subset has total weight at most the capacity. (0/1 knapsack optimum (variant 3): emphasize each item used at most once across the witness subset.)",
      "criticality": "critical",
      "common_failure_modes": [
        "dropping the capacity constraint",
        "applying strict inequality"
      ]
    },
    {
      "id": "SU3",
      "description": "Value witness: there is a valid selection whose total value equals the returned result. (0/1 knapsack optimum (variant 3): emphasize each item used at most once across the witness subset.)",
      "criticality": "critical",
      "common_failure_modes": [
        "stating only a value upper bound"
      ]
    },
    {
      "id": "SU4",
      "description": "Optimality: no valid selection with total weight <= capacity achieves a strictly greater total value. (0/1 knapsack optimum (variant 3): emphasize each item used at most once across the witness subset.)",
      "criticality": "critical",
      "common_failure_modes": [
        "stating only the witness (admits 'return 0')",
        "reducing to unbounded knapsack (allowing repeats)"
      ]
    },
    {
      "id": "SU5",
      "description": "0/1 uniqueness: items appear at most once in any witness selection. (0/1 knapsack optimum (variant 3): emphasize each item used at most once across the witness subset.)",
      "criticality": "supporting",
      "common_failure_modes": [
        "allowing multiplicities (unbounded knapsack)"
      ]
    }
  ]
}
