{
  "schema_version": "schema_v1",
  "instance_id": "trees_bst_insert_006",
  "benchmark_version": "v0.3",
  "units": [
    {
      "id": "SU1",
      "description": "BST precondition: the input tree is a valid BST (in-order strictly ascending). (BST insertion (variant 6): emphasize height growth and logarithmic-time claims are out-of-scope unless stated.)",
      "criticality": "critical",
      "common_failure_modes": [
        "relaxing to nondecreasing (allowing duplicates)",
        "omitting the precondition"
      ]
    },
    {
      "id": "SU2",
      "description": "BST invariant preservation: the output tree is also a valid BST. (BST insertion (variant 6): emphasize height growth and logarithmic-time claims are out-of-scope unless stated.)",
      "criticality": "critical",
      "common_failure_modes": [
        "omitting invariant preservation",
        "asserting it only when the key is absent"
      ]
    },
    {
      "id": "SU3",
      "description": "Key-set change: the output's key multiset is the input's multiset union {key} if the key was absent, else equals the input's multiset. (BST insertion (variant 6): emphasize height growth and logarithmic-time claims are out-of-scope unless stated.)",
      "criticality": "critical",
      "common_failure_modes": [
        "asserting insertion regardless of duplicates (breaks BST uniqueness)",
        "asserting subset only"
      ]
    },
    {
      "id": "SU4",
      "description": "Duplicate no-op: inserting an existing key returns a tree with the same key multiset. (BST insertion (variant 6): emphasize height growth and logarithmic-time claims are out-of-scope unless stated.)",
      "criticality": "supporting",
      "common_failure_modes": [
        "allowing duplicates after insertion"
      ]
    }
  ]
}
