{
  "schema_version": "schema_v1",
  "instance_id": "graph_dijkstra_001",
  "benchmark_version": "v0.3",
  "units": [
    {
      "id": "SU1",
      "description": "Input precondition: every edge's endpoints lie in [0, n) and every weight is non-negative. (V001 baseline.)",
      "criticality": "critical"
    },
    {
      "id": "SU2",
      "description": "Size: the returned dist vector has length n. (V001 baseline.)",
      "criticality": "critical"
    },
    {
      "id": "SU3",
      "description": "Source: dist[source] == Some(0). (V001 baseline.)",
      "criticality": "critical"
    },
    {
      "id": "SU4",
      "description": "Achievability: if dist[v] == Some(d), there exists a path from source to v with total weight d. (V001 baseline.)",
      "criticality": "critical"
    },
    {
      "id": "SU5",
      "description": "Optimality: if dist[v] == Some(d), no path from source to v has total weight less than d. (V001 baseline.)",
      "criticality": "critical",
      "common_failure_modes": [
        "stating only a weaker existence claim",
        "asserting only on the shortest-path tree edges"
      ]
    },
    {
      "id": "SU6",
      "description": "Unreachability: if dist[v] == None, there is no path from source to v. (V001 baseline.)",
      "criticality": "critical"
    },
    {
      "id": "SU7",
      "description": "Termination on every valid input. (V001 baseline.)",
      "criticality": "supporting"
    }
  ]
}
