{
  "schema_version": "schema_v1",
  "instance_id": "sorting_insertion_sort_003",
  "benchmark_version": "v0.3",
  "units": [
    {
      "id": "SU1",
      "description": "Sortedness: the output list is sorted in nondecreasing order. (Variant 3 stresses boundary preconditions and explicit edge-case coverage in the informal contract.)",
      "criticality": "critical"
    },
    {
      "id": "SU2",
      "description": "Permutation: the output is a permutation of the input (every element preserved, counts preserved). (Variant 3 stresses boundary preconditions and explicit edge-case coverage in the informal contract.)",
      "criticality": "critical",
      "common_failure_modes": [
        "asserting set equality without counting duplicates",
        "asserting length preservation only"
      ]
    },
    {
      "id": "SU3",
      "description": "Termination on every input. (Variant 3 stresses boundary preconditions and explicit edge-case coverage in the informal contract.)",
      "criticality": "supporting"
    },
    {
      "id": "SU4",
      "description": "Stability is NOT required and should not be asserted. (Variant 3 stresses boundary preconditions and explicit edge-case coverage in the informal contract.)",
      "criticality": "optional"
    }
  ]
}
